{"schemaVersion":1,"id":"mkt_1","instrument":"SPY","market":"US_EQUITY","interval":"PT15M","bar":{"startAt":"2026-10-12T14:30:00Z","endAt":"2026-10-12T14:45:00Z","open":"550.10","high":"550.30","low":"550.00","close":"550.25","volume":"12500","closed":true},"eventTime":"2026-10-12T14:45:00Z","receivedAt":"2026-10-12T14:45:01Z","availableAt":"2026-10-12T14:45:02Z","asOf":"2026-10-12T14:45:02Z","features":{"return15m":"0.00027"},"evidence":{"neutral":true,"sources":["alpaca:bar:SPY:2026-10-12T14:45:00Z"],"availableAt":"2026-10-12T14:45:02Z","conflicts":[],"quality":"VALID"},"spread":"0.01","quality":"VALID","portfolio":{"equity":"100000.00","cash":"100000.00"},"position":{"quantity":"0"},"traceId":"4bf92f3577b34da6a3ce929d0e0e4736"}
